DATAPRESENTACAOPROPOSICAO;DATTRANSFPROPOSICAOLEI;COD_TIPO_PARLAMENTAR;NOM_CIVIL_PARLAMENTAR;NOM_PARLAMENTAR;COD_SEXO;DES_TIPO_PARLAMENTAR;COD_PARLAMENTAR_ORIGEM;NUM_LEGISLATURA_APRESEN;NUM_SESSAO_LEGISLATIVA_APRESEN;COD_TIPO_SESSAO_LEGISLATIVA_APRESEN;DAT_INICIO_LEGISLATURA_APRESEN;DAT_FIM_LEGISLATURA_APRESEN;DAT_INICIO_SESSAO_LEGISLATIVA_APRESEN;DAT_FIM_SESSAO_LEGISLATIVA_APRESEN;DES_TIPO_SESSAO_LEGISLATIVA_APRESEN;DAT_INICIAL_RECESSO_APRESEN;DAT_FINAL_RECESSO_APRESEN;NUM_LEGISLATURA_LEI;NUM_SESSAO_LEGISLATIVA_LEI;COD_TIPO_SESSAO_LEGISLATIVA_LEI;DAT_INICIO_LEGISLATURA_LEI;DAT_FIM_LEGISLATURA_LEI;DAT_INICIO_SESSAO_LEGISLATIVA_LEI;DAT_FIM_SESSAO_LEGISLATIVA_LEI;DES_TIPO_SESSAO_LEGISLATIVA_LEI;DAT_INICIAL_RECESSO_LEI;DAT_FINAL_RECESSO_LEI;COD_PROPOSICAO_ORIGEM;ANO_PROPOSICAO;NUM_PROPOSICAO;NOM_PROPOSICAO;AREAS_TEMATICAS_APRESENTACAO;SIG_NORMA_JURIDICA;DES_TIPO_NORMA_JURIDICA;COD_TIPO_NORMA_JURIDICA_ORIGEM;SIG_UF;TEX_REGIAO_GEOGRAFICA_AUTOR;NOM_UF;NOM_PARTIDO_POLITICO;COD_PARTIDO_POLITICO;SIG_PARTIDO_POLITICO;DES_SITUACAO_PROPOSICAO;SIG_TIPO_PROPOSICAO;DES_TIPO_PROPOSICAO;DES_COMPLETA;IND_ATIVO_TIPO_PROPOSICAO;DES_ATIVO_TIPO_PROPOSICAO;DAT_VETO_TOTAL;NOM_ORGAO;IND_ATIVO_ORGAO;DES_ATIVO_ORGAO;COD_ORGAO_ORIGEM;DES_APELIDO_ORGAO;COD_TIPO_AUTOR_ORIGEM;DES_TIPO_AUTOR
21-07-2005;;10000;IVO JOSÉ DA SILVA;IVO JOSÉ;M;DEPUTADO;521037;52;3;1;01-02-2003;31-01-2007;15-02-2005;15-12-2005;Ordinária;;;-1;-1;-1;;;;;N/A;;;294399;2005;5663;PL 5663/2005;MEIO AMBIENTE E DESENVOLVIMENTO SUSTENTÁVEL,POLÍTICA FUNDIÁRIA;N/A;N/A;-1;MG;SUDESTE;MINAS GERAIS;PARTIDO DOS TRABALHADORES;134;PT;N/A;PL;PROJETO DE LEI;PROJETO DE LEI;1;ATIVADO;;N/A;-1;N/A;-1;N/A;TipoParlamentar_10000;DEPUTADO
31-05-2005;;10000;RICARTE DE FREITAS JUNIOR;RICARTE DE FREITAS;M;DEPUTADO;521552;52;3;1;01-02-2003;31-01-2007;15-02-2005;15-12-2005;Ordinária;;;-1;-1;-1;;;;;N/A;;;287367;2005;5321;PL 5321/2005;DESENVOLVIMENTO URBANO E TRÂNSITO,MEIO AMBIENTE E DESENVOLVIMENTO SUSTENTÁVEL;N/A;N/A;-1;MT;CENTRO-OESTE;MATO GROSSO;PARTIDO TRABALHISTA BRASILEIRO;136;PTB;N/A;PL;PROJETO DE LEI;PROJETO DE LEI;1;ATIVADO;;N/A;-1;N/A;-1;N/A;TipoParlamentar_10000;DEPUTADO
08-06-2005;;10000;JOSÉ SARNEY FILHO;SARNEY FILHO;M;DEPUTADO;520939;52;3;1;01-02-2003;31-01-2007;15-02-2005;15-12-2005;Ordinária;;;-1;-1;-1;;;;;N/A;;;288732;2005;5398;PL 5398/2005;MEIO AMBIENTE E DESENVOLVIMENTO SUSTENTÁVEL;N/A;N/A;-1;MA;NORDESTE;MARANHÃO;PARTIDO VERDE;140;PV;N/A;PL;PROJETO DE LEI;PROJETO DE LEI;1;ATIVADO;;N/A;-1;N/A;-1;N/A;TipoParlamentar_10000;DEPUTADO
06-10-2004;;10000;CARLOS ALBERTO RODRIGUES PINTO;CARLOS RODRIGUES;M;DEPUTADO;522486;52;2;1;01-02-2003;31-01-2007;15-02-2004;15-12-2004;Ordinária;13-07-2004;01-08-2004;-1;-1;-1;;;;;N/A;;;266032;2004;4225;PL 4225/2004;MEIO AMBIENTE E DESENVOLVIMENTO SUSTENTÁVEL;N/A;N/A;-1;RJ;SUDESTE;RIO DE JANEIRO;PARTIDO LIBERAL;110;PL;N/A;PL;PROJETO DE LEI;PROJETO DE LEI;1;ATIVADO;;N/A;-1;N/A;-1;N/A;TipoParlamentar_10000;DEPUTADO
13-04-2010;;10000;VANESSA GRAZZIOTIN;VANESSA GRAZZIOTIN;F;DEPUTADO;520210;53;4;1;01-02-2007;31-01-2011;02-02-2010;22-12-2010;Ordinária;19-07-2010;02-08-2010;-1;-1;-1;;;;;N/A;;;473027;2010;7114;PL 7114/2010;INDÚSTRIA, COMÉRCIO E DEFESA DO CONSUMIDOR (UTILIZADO ATÉ A LEGISLATURA 53),MEIO AMBIENTE E DESENVOLVIMENTO SUSTENTÁVEL;N/A;N/A;-1;AM;NORTE;AMAZONAS;PARTIDO COMUNISTA DO BRASIL;99;PCDOB;N/A;PL;PROJETO DE LEI;PROJETO DE LEI;1;ATIVADO;;N/A;-1;N/A;-1;N/A;TipoParlamentar_10000;DEPUTADO
13-12-2005;;10000;CARLOS FREDERICO THEODORO NADER;CARLOS NADER;M;DEPUTADO;522538;52;3;1;01-02-2003;31-01-2007;15-02-2005;15-12-2005;Ordinária;;;-1;-1;-1;;;;;N/A;;;309962;2005;6373;PL 6373/2005;MEIO AMBIENTE E DESENVOLVIMENTO SUSTENTÁVEL;N/A;N/A;-1;RJ;SUDESTE;RIO DE JANEIRO;PARTIDO LIBERAL;110;PL;N/A;PL;PROJETO DE LEI;PROJETO DE LEI;1;ATIVADO;;N/A;-1;N/A;-1;N/A;TipoParlamentar_10000;DEPUTADO
14-10-2009;;10000;FELIPE LEONE BORNIER DE OLIVEIRA;FELIPE BORNIER;M;DEPUTADO;527042;53;3;1;01-02-2007;31-01-2011;02-02-2009;22-12-2009;Ordinária;17-07-2009;03-08-2009;-1;-1;-1;;;;;N/A;;;455251;2009;6235;PL 6235/2009;ADMINISTRAÇÃO PÚBLICA,MEIO AMBIENTE E DESENVOLVIMENTO SUSTENTÁVEL;N/A;N/A;-1;RJ;SUDESTE;RIO DE JANEIRO;PARTIDO HUMANISTA DA SOLIDARIEDADE;109;PHS;N/A;PL;PROJETO DE LEI;PROJETO DE LEI;1;ATIVADO;;N/A;-1;N/A;-1;N/A;TipoParlamentar_10000;DEPUTADO
20-02-2003;;10000;RONALDO VASCONCELLOS NOVAIS;RONALDO VASCONCELLOS;M;DEPUTADO;521183;52;1;1;01-02-2003;31-01-2007;17-02-2003;15-12-2003;Ordinária;30-06-2003;01-08-2003;-1;-1;-1;;;;;N/A;;;104822;2003;128;PL 128/2003;MEIO AMBIENTE E DESENVOLVIMENTO SUSTENTÁVEL,RECURSOS HÍDRICOS, MINERAIS E POLÍTICA ENERGÉTICA;N/A;N/A;-1;MG;SUDESTE;MINAS GERAIS;PARTIDO TRABALHISTA BRASILEIRO;136;PTB;N/A;PL;PROJETO DE LEI;PROJETO DE LEI;1;ATIVADO;;N/A;-1;N/A;-1;N/A;TipoParlamentar_10000;DEPUTADO
18-02-2003;;10000;HELENO AUGUSTO DE LIMA;DR. HELENO;M;DEPUTADO;522706;52;1;1;01-02-2003;31-01-2007;17-02-2003;15-12-2003;Ordinária;30-06-2003;01-08-2003;-1;-1;-1;;;;;N/A;;;104481;2003;64;PL 64/2003;MEIO AMBIENTE E DESENVOLVIMENTO SUSTENTÁVEL;N/A;N/A;-1;RJ;SUDESTE;RIO DE JANEIRO;PARTIDO DA SOCIAL DEMOCRACIA BRASILEIRA;128;PSDB;N/A;PL;PROJETO DE LEI;PROJETO DE LEI;1;ATIVADO;;N/A;-1;N/A;-1;N/A;TipoParlamentar_10000;DEPUTADO
21-02-2003;;10000;LUCIANO DE SOUZA CASTRO;LUCIANO CASTRO;M;DEPUTADO;523023;52;1;1;01-02-2003;31-01-2007;17-02-2003;15-12-2003;Ordinária;30-06-2003;01-08-2003;-1;-1;-1;;;;;N/A;;;104902;2003;143;PL 143/2003;MEIO AMBIENTE E DESENVOLVIMENTO SUSTENTÁVEL;N/A;N/A;-1;RR;NORTE;RORAIMA;PARTIDO DA FRENTE LIBERAL;106;PFL;N/A;PL;PROJETO DE LEI;PROJETO DE LEI;1;ATIVADO;;N/A;-1;N/A;-1;N/A;TipoParlamentar_10000;DEPUTADO
19-02-2003;;10000;JOÃO ALFREDO TELLES MELO;JOÃO ALFREDO;M;DEPUTADO;520419;52;1;1;01-02-2003;31-01-2007;17-02-2003;15-12-2003;Ordinária;30-06-2003;01-08-2003;-1;-1;-1;;;;;N/A;;;104670;2003;91;PL 91/2003;MEIO AMBIENTE E DESENVOLVIMENTO SUSTENTÁVEL;N/A;N/A;-1;CE;NORDESTE;CEARÁ;PARTIDO DOS TRABALHADORES;134;PT;N/A;PL;PROJETO DE LEI;PROJETO DE LEI;1;ATIVADO;;N/A;-1;N/A;-1;N/A;TipoParlamentar_10000;DEPUTADO
18-03-2003;14-07-2004;10000;MARIA LAURA MONTEZA DE SOUZA CARNEIRO;LAURA CARNEIRO;F;DEPUTADO;522543;52;1;1;01-02-2003;31-01-2007;17-02-2003;15-12-2003;Ordinária;30-06-2003;01-08-2003;52;2;1;01-02-2003;31-01-2007;15-02-2004;15-12-2004;Ordinária;13-07-2004;01-08-2004;106924;2003;378;PL 378/2003;MEIO AMBIENTE E DESENVOLVIMENTO SUSTENTÁVEL;LEI;LEI ORDINÁRIA;37;RJ;SUDESTE;RIO DE JANEIRO;PARTIDO DA FRENTE LIBERAL;106;PFL;TRANSFORMADA EM NORMA;PL;PROJETO DE LEI;PROJETO DE LEI;1;ATIVADO;;N/A;-1;N/A;-1;N/A;TipoParlamentar_10000;DEPUTADO
13-08-2003;;10000;IRINEU MARIO COLOMBO;COLOMBO;M;DEPUTADO;522067;52;1;1;01-02-2003;31-01-2007;17-02-2003;15-12-2003;Ordinária;30-06-2003;01-08-2003;-1;-1;-1;;;;;N/A;;;127808;2003;1681;PL 1681/2003;MEIO AMBIENTE E DESENVOLVIMENTO SUSTENTÁVEL;N/A;N/A;-1;PR;SUL;PARANÁ;PARTIDO DOS TRABALHADORES;134;PT;N/A;PL;PROJETO DE LEI;PROJETO DE LEI;1;ATIVADO;;N/A;-1;N/A;-1;N/A;TipoParlamentar_10000;DEPUTADO
24-03-2004;;10000;EDSON GONÇALVES DUARTE;EDSON DUARTE;M;DEPUTADO;520399;52;2;1;01-02-2003;31-01-2007;15-02-2004;15-12-2004;Ordinária;13-07-2004;01-08-2004;-1;-1;-1;;;;;N/A;;;157740;2004;3225;PL 3225/2004;MEIO AMBIENTE E DESENVOLVIMENTO SUSTENTÁVEL;N/A;N/A;-1;BA;NORDESTE;BAHIA;PARTIDO VERDE;140;PV;N/A;PL;PROJETO DE LEI;PROJETO DE LEI;1;ATIVADO;;N/A;-1;N/A;-1;N/A;TipoParlamentar_10000;DEPUTADO
07-07-2004;;10000;ANN CLÉLIA DE BARROS PONTES;ANN PONTES;F;DEPUTADO;521602;52;2;1;01-02-2003;31-01-2007;15-02-2004;15-12-2004;Ordinária;13-07-2004;01-08-2004;-1;-1;-1;;;;;N/A;;;260606;2004;3957;PL 3957/2004;MEIO AMBIENTE E DESENVOLVIMENTO SUSTENTÁVEL;N/A;N/A;-1;PA;NORTE;PARÁ;PARTIDO DO MOVIMENTO DEMOCRÁTICO BRASILEIRO;111;PMDB;N/A;PL;PROJETO DE LEI;PROJETO DE LEI;1;ATIVADO;;N/A;-1;N/A;-1;N/A;TipoParlamentar_10000;DEPUTADO
18-11-2003;;10000;RICARTE DE FREITAS JUNIOR;RICARTE DE FREITAS;M;DEPUTADO;521552;52;1;1;01-02-2003;31-01-2007;17-02-2003;15-12-2003;Ordinária;30-06-2003;01-08-2003;-1;-1;-1;;;;;N/A;;;143211;2003;2512;PL 2512/2003;MEIO AMBIENTE E DESENVOLVIMENTO SUSTENTÁVEL;N/A;N/A;-1;MT;CENTRO-OESTE;MATO GROSSO;PARTIDO TRABALHISTA BRASILEIRO;136;PTB;N/A;PL;PROJETO DE LEI;PROJETO DE LEI;1;ATIVADO;;N/A;-1;N/A;-1;N/A;TipoParlamentar_10000;DEPUTADO
17-03-2010;;10000;VANESSA GRAZZIOTIN;VANESSA GRAZZIOTIN;F;DEPUTADO;520210;53;4;1;01-02-2007;31-01-2011;02-02-2010;22-12-2010;Ordinária;19-07-2010;02-08-2010;-1;-1;-1;;;;;N/A;;;469800;2010;6978;PL 6978/2010;INDÚSTRIA, COMÉRCIO E ABASTECIMENTO,MEIO AMBIENTE E DESENVOLVIMENTO SUSTENTÁVEL;N/A;N/A;-1;AM;NORTE;AMAZONAS;PARTIDO COMUNISTA DO BRASIL;99;PCDOB;N/A;PL;PROJETO DE LEI;PROJETO DE LEI;1;ATIVADO;;N/A;-1;N/A;-1;N/A;TipoParlamentar_10000;DEPUTADO
25-05-2011;;10000;GUILHERME MUSSI FERREIRA;GUILHERME MUSSI;M;DEPUTADO;530203;54;1;1;01-02-2011;31-01-2015;02-02-2011;22-12-2011;Ordinária;18-07-2011;01-08-2011;-1;-1;-1;;;;;N/A;;;503824;2011;1437;PL 1437/2011;MEIO AMBIENTE E DESENVOLVIMENTO SUSTENTÁVEL;N/A;N/A;-1;SP;SUDESTE;SÃO PAULO;PARTIDO VERDE;140;PV;N/A;PL;PROJETO DE LEI;PROJETO DE LEI;1;ATIVADO;;N/A;-1;N/A;-1;N/A;TipoParlamentar_10000;DEPUTADO
23-08-2011;;10000;JOSÉ RICARDO ALVARENGA TRIPOLI;RICARDO TRIPOLI;M;DEPUTADO;528647;54;1;1;01-02-2011;31-01-2015;02-02-2011;22-12-2011;Ordinária;18-07-2011;01-08-2011;-1;-1;-1;;;;;N/A;;;516828;2011;2086;PL 2086/2011;MEIO AMBIENTE E DESENVOLVIMENTO SUSTENTÁVEL;N/A;N/A;-1;SP;SUDESTE;SÃO PAULO;PARTIDO DA SOCIAL DEMOCRACIA BRASILEIRA;128;PSDB;N/A;PL;PROJETO DE LEI;PROJETO DE LEI;1;ATIVADO;;N/A;-1;N/A;-1;N/A;TipoParlamentar_10000;DEPUTADO
20-05-2003;;10000;JOSÉ RENATO CASAGRANDE;RENATO CASAGRANDE;M;DEPUTADO;520718;52;1;1;01-02-2003;31-01-2007;17-02-2003;15-12-2003;Ordinária;30-06-2003;01-08-2003;-1;-1;-1;;;;;N/A;;;116128;2003;1016;PL 1016/2003;MEIO AMBIENTE E DESENVOLVIMENTO SUSTENTÁVEL;N/A;N/A;-1;ES;SUDESTE;ESPÍRITO SANTO;PARTIDO SOCIALISTA BRASILEIRO;125;PSB;N/A;PL;PROJETO DE LEI;PROJETO DE LEI;1;ATIVADO;;N/A;-1;N/A;-1;N/A;TipoParlamentar_10000;DEPUTADO
15-06-2011;;10000;CARLOS HENRIQUE FOCESI SAMPAIO;CARLOS SAMPAIO;M;DEPUTADO;524095;54;1;1;01-02-2011;31-01-2015;02-02-2011;22-12-2011;Ordinária;18-07-2011;01-08-2011;-1;-1;-1;;;;;N/A;;;509340;2011;41;PEC 41/2011;MEIO AMBIENTE E DESENVOLVIMENTO SUSTENTÁVEL,RECURSOS HÍDRICOS, MINERAIS E POLÍTICA ENERGÉTICA;N/A;N/A;-1;SP;SUDESTE;SÃO PAULO;PARTIDO DA SOCIAL DEMOCRACIA BRASILEIRA;128;PSDB;N/A;PEC;PROPOSTA DE EMENDA À CONSTITUIÇÃO;PROPOSTA DE EMENDA À CONSTITUIÇÃO (ART. 60 CF C/C ART. 201 A 203, RICD);1;ATIVADO;;N/A;-1;N/A;-1;N/A;TipoParlamentar_10000;DEPUTADO
12-06-2002;;10000;JOSÉ CARLOS PIRES COUTINHO;JOSÉ CARLOS COUTINHO;M;DEPUTADO;1661;51;4;1;01-02-1999;31-01-2003;15-02-2002;16-12-2002;Ordinária;02-07-2002;01-08-2002;-1;-1;-1;;;;;N/A;;;56626;2002;6970;PL 6970/2002;MEIO AMBIENTE E DESENVOLVIMENTO SUSTENTÁVEL;N/A;N/A;-1;RJ;SUDESTE;RIO DE JANEIRO;PARTIDO DA FRENTE LIBERAL;106;PFL;N/A;PL;PROJETO DE LEI;PROJETO DE LEI;1;ATIVADO;;N/A;-1;N/A;-1;N/A;TipoParlamentar_10000;DEPUTADO
15-04-2009;;10000;ROBERTO COELHO ROCHA;ROBERTO ROCHA;M;DEPUTADO;525470;53;3;1;01-02-2007;31-01-2011;02-02-2009;22-12-2009;Ordinária;17-07-2009;03-08-2009;-1;-1;-1;;;;;N/A;;;430593;2009;353;PEC 353/2009;MEIO AMBIENTE E DESENVOLVIMENTO SUSTENTÁVEL,TRIBUTAÇÃO;N/A;N/A;-1;MA;NORDESTE;MARANHÃO;PARTIDO DA SOCIAL DEMOCRACIA BRASILEIRA;128;PSDB;N/A;PEC;PROPOSTA DE EMENDA À CONSTITUIÇÃO;PROPOSTA DE EMENDA À CONSTITUIÇÃO (ART. 60 CF C/C ART. 201 A 203, RICD);1;ATIVADO;;N/A;-1;N/A;-1;N/A;TipoParlamentar_10000;DEPUTADO
25-03-2008;;10000;JUVENIL ALVES FERREIRA FILHO;JUVENIL;M;DEPUTADO;525761;53;2;1;01-02-2007;31-01-2011;06-02-2008;22-12-2008;Ordinária;17-07-2008;01-08-2008;-1;-1;-1;;;;;N/A;;;387792;2008;3072;PL 3072/2008;MEIO AMBIENTE E DESENVOLVIMENTO SUSTENTÁVEL,TRIBUTAÇÃO;N/A;N/A;-1;MG;SUDESTE;MINAS GERAIS;PARTIDO RENOVADOR TRABALHISTA BRASILEIRO;123;PRTB;N/A;PL;PROJETO DE LEI;PROJETO DE LEI;1;ATIVADO;;N/A;-1;N/A;-1;N/A;TipoParlamentar_10000;DEPUTADO
18-09-2007;;10000;FRANCISCO MARCELO ORTIZ FILHO;MARCELO ORTIZ;M;DEPUTADO;524017;53;1;1;01-02-2007;31-01-2011;02-02-2007;24-12-2007;Ordinária;17-07-2007;01-08-2007;-1;-1;-1;;;;;N/A;;;368064;2007;2047;PL 2047/2007;ARTE E CULTURA,MEIO AMBIENTE E DESENVOLVIMENTO SUSTENTÁVEL;N/A;N/A;-1;SP;SUDESTE;SÃO PAULO;PARTIDO VERDE;140;PV;N/A;PL;PROJETO DE LEI;PROJETO DE LEI;1;ATIVADO;;N/A;-1;N/A;-1;N/A;TipoParlamentar_10000;DEPUTADO
07-04-2009;;10000;VANESSA GRAZZIOTIN;VANESSA GRAZZIOTIN;F;DEPUTADO;520210;53;3;1;01-02-2007;31-01-2011;02-02-2009;22-12-2009;Ordinária;17-07-2009;03-08-2009;-1;-1;-1;;;;;N/A;;;429220;2009;4999;PL 4999/2009;MEIO AMBIENTE E DESENVOLVIMENTO SUSTENTÁVEL;N/A;N/A;-1;AM;NORTE;AMAZONAS;PARTIDO COMUNISTA DO BRASIL;99;PCDOB;N/A;PL;PROJETO DE LEI;PROJETO DE LEI;1;ATIVADO;;N/A;-1;N/A;-1;N/A;TipoParlamentar_10000;DEPUTADO
13-03-2008;;10000;LUCIANO PIZZATTO;LUCIANO PIZZATTO;M;DEPUTADO;526731;53;2;1;01-02-2007;31-01-2011;06-02-2008;22-12-2008;Ordinária;17-07-2008;01-08-2008;-1;-1;-1;;;;;N/A;;;386561;2008;2995;PL 2995/2008;MEIO AMBIENTE E DESENVOLVIMENTO SUSTENTÁVEL;N/A;N/A;-1;PR;SUL;PARANÁ;DEMOCRATAS;202;DEM;N/A;PL;PROJETO DE LEI;PROJETO DE LEI;1;ATIVADO;;N/A;-1;N/A;-1;N/A;TipoParlamentar_10000;DEPUTADO
24-04-2008;;10000;SILVIO ROBERTO CAVALCANTI PECCIOLI;SILVINHO PECCIOLI;M;DEPUTADO;529007;53;2;1;01-02-2007;31-01-2011;06-02-2008;22-12-2008;Ordinária;17-07-2008;01-08-2008;-1;-1;-1;;;;;N/A;;;392137;2008;3324;PL 3324/2008;MEIO AMBIENTE E DESENVOLVIMENTO SUSTENTÁVEL;N/A;N/A;-1;SP;SUDESTE;SÃO PAULO;DEMOCRATAS;202;DEM;N/A;PL;PROJETO DE LEI;PROJETO DE LEI;1;ATIVADO;;N/A;-1;N/A;-1;N/A;TipoParlamentar_10000;DEPUTADO
01-09-2011;;10000;JÚLIO JOSÉ DE CAMPOS;JÚLIO CAMPOS;M;DEPUTADO;530087;54;1;1;01-02-2011;31-01-2015;02-02-2011;22-12-2011;Ordinária;18-07-2011;01-08-2011;-1;-1;-1;;;;;N/A;;;518754;2011;2215;PL 2215/2011;MEIO AMBIENTE E DESENVOLVIMENTO SUSTENTÁVEL;N/A;N/A;-1;MT;CENTRO-OESTE;MATO GROSSO;DEMOCRATAS;202;DEM;N/A;PL;PROJETO DE LEI;PROJETO DE LEI;1;ATIVADO;;N/A;-1;N/A;-1;N/A;TipoParlamentar_10000;DEPUTADO
13-12-2007;;10000;EDUARDO VALVERDE ARAÚJO ALVES;EDUARDO VALVERDE;M;DEPUTADO;522902;53;1;1;01-02-2007;31-01-2011;02-02-2007;24-12-2007;Ordinária;17-07-2007;01-08-2007;-1;-1;-1;;;;;N/A;;;381211;2007;2635;PL 2635/2007;MEIO AMBIENTE E DESENVOLVIMENTO SUSTENTÁVEL,RECURSOS HÍDRICOS, MINERAIS E POLÍTICA ENERGÉTICA;N/A;N/A;-1;RO;NORTE;RONDÔNIA;PARTIDO DOS TRABALHADORES;134;PT;N/A;PL;PROJETO DE LEI;PROJETO DE LEI;1;ATIVADO;;N/A;-1;N/A;-1;N/A;TipoParlamentar_10000;DEPUTADO
16-09-2003;;10000;REINALDO PEREIRA PINTO;REINALDO BETÃO;M;DEPUTADO;522565;52;1;1;01-02-2003;31-01-2007;17-02-2003;15-12-2003;Ordinária;30-06-2003;01-08-2003;-1;-1;-1;;;;;N/A;;;133313;2003;1980;PL 1980/2003;INDÚSTRIA, COMÉRCIO E DEFESA DO CONSUMIDOR (UTILIZADO ATÉ A LEGISLATURA 53),MEIO AMBIENTE E DESENVOLVIMENTO SUSTENTÁVEL;N/A;N/A;-1;RJ;SUDESTE;RIO DE JANEIRO;PARTIDO LIBERAL;110;PL;N/A;PL;PROJETO DE LEI;PROJETO DE LEI;1;ATIVADO;;N/A;-1;N/A;-1;N/A;TipoParlamentar_10000;DEPUTADO
13-12-2005;;10000;CARLOS FREDERICO THEODORO NADER;CARLOS NADER;M;DEPUTADO;522538;52;3;1;01-02-2003;31-01-2007;15-02-2005;15-12-2005;Ordinária;;;-1;-1;-1;;;;;N/A;;;309964;2005;6375;PL 6375/2005;MEIO AMBIENTE E DESENVOLVIMENTO SUSTENTÁVEL,TRIBUTAÇÃO;N/A;N/A;-1;RJ;SUDESTE;RIO DE JANEIRO;PARTIDO LIBERAL;110;PL;N/A;PL;PROJETO DE LEI;PROJETO DE LEI;1;ATIVADO;;N/A;-1;N/A;-1;N/A;TipoParlamentar_10000;DEPUTADO
26-09-2007;;10000;VINICIUS RAPOZO DE CARVALHO;VINICIUS CARVALHO;M;DEPUTADO;527495;53;1;1;01-02-2007;31-01-2011;02-02-2007;24-12-2007;Ordinária;17-07-2007;01-08-2007;-1;-1;-1;;;;;N/A;;;369552;2007;2138;PL 2138/2007;MEIO AMBIENTE E DESENVOLVIMENTO SUSTENTÁVEL,VIAÇÃO E TRANSPORTES;N/A;N/A;-1;RJ;SUDESTE;RIO DE JANEIRO;PARTIDO TRABALHISTA DO BRASIL;200;PTDOB;N/A;PL;PROJETO DE LEI;PROJETO DE LEI;1;ATIVADO;;N/A;-1;N/A;-1;N/A;TipoParlamentar_10000;DEPUTADO
14-12-2006;;10000;MARIÂNGELA DE ARAÚJO GAMA DUARTE;MARIÂNGELA DUARTE;F;DEPUTADO;523526;52;4;1;01-02-2003;31-01-2007;15-02-2006;22-12-2006;Ordinária;;;-1;-1;-1;;;;;N/A;;;338680;2006;7675;PL 7675/2006;MEIO AMBIENTE E DESENVOLVIMENTO SUSTENTÁVEL;N/A;N/A;-1;SP;SUDESTE;SÃO PAULO;PARTIDO DOS TRABALHADORES;134;PT;N/A;PL;PROJETO DE LEI;PROJETO DE LEI;1;ATIVADO;;N/A;-1;N/A;-1;N/A;TipoParlamentar_10000;DEPUTADO
06-11-2007;;10000;REBECCA MARTINS GARCIA;REBECCA GARCIA;F;DEPUTADO;524687;53;1;1;01-02-2007;31-01-2011;02-02-2007;24-12-2007;Ordinária;17-07-2007;01-08-2007;-1;-1;-1;;;;;N/A;;;375759;2007;2373;PL 2373/2007;INDÚSTRIA, COMÉRCIO E DEFESA DO CONSUMIDOR (UTILIZADO ATÉ A LEGISLATURA 53),MEIO AMBIENTE E DESENVOLVIMENTO SUSTENTÁVEL;N/A;N/A;-1;AM;NORTE;AMAZONAS;PARTIDO PROGRESSISTA;115;PP;N/A;PL;PROJETO DE LEI;PROJETO DE LEI;1;ATIVADO;;N/A;-1;N/A;-1;N/A;TipoParlamentar_10000;DEPUTADO
28-10-2009;;10000;MARIA PERPÉTUA DE ALMEIDA;PERPÉTUA ALMEIDA;F;DEPUTADO;520068;53;3;1;01-02-2007;31-01-2011;02-02-2009;22-12-2009;Ordinária;17-07-2009;03-08-2009;-1;-1;-1;;;;;N/A;;;457330;2009;6313;PL 6313/2009;MEIO AMBIENTE E DESENVOLVIMENTO SUSTENTÁVEL;N/A;N/A;-1;AC;NORTE;ACRE;PARTIDO COMUNISTA DO BRASIL;99;PCDOB;N/A;PL;PROJETO DE LEI;PROJETO DE LEI;1;ATIVADO;;N/A;-1;N/A;-1;N/A;TipoParlamentar_10000;DEPUTADO
19-02-2008;;10000;REBECCA MARTINS GARCIA;REBECCA GARCIA;F;DEPUTADO;524687;53;2;1;01-02-2007;31-01-2011;06-02-2008;22-12-2008;Ordinária;17-07-2008;01-08-2008;-1;-1;-1;;;;;N/A;;;383746;2008;2854;PL 2854/2008;MEIO AMBIENTE E DESENVOLVIMENTO SUSTENTÁVEL;N/A;N/A;-1;AM;NORTE;AMAZONAS;PARTIDO PROGRESSISTA;115;PP;N/A;PL;PROJETO DE LEI;PROJETO DE LEI;1;ATIVADO;;N/A;-1;N/A;-1;N/A;TipoParlamentar_10000;DEPUTADO
19-05-2008;;10000;FLÁVIO BEZERRA DA SILVA;FLÁVIO BEZERRA;M;DEPUTADO;524972;53;2;1;01-02-2007;31-01-2011;06-02-2008;22-12-2008;Ordinária;17-07-2008;01-08-2008;-1;-1;-1;;;;;N/A;;;395513;2008;3431;PL 3431/2008;MEIO AMBIENTE E DESENVOLVIMENTO SUSTENTÁVEL;N/A;N/A;-1;CE;NORDESTE;CEARÁ;PARTIDO DO MOVIMENTO DEMOCRÁTICO BRASILEIRO;111;PMDB;N/A;PL;PROJETO DE LEI;PROJETO DE LEI;1;ATIVADO;;N/A;-1;N/A;-1;N/A;TipoParlamentar_10000;DEPUTADO
23-09-2009;;10000;JOSÉ MENTOR GUILHERME DE MELLO NETTO;JOSÉ MENTOR;M;DEPUTADO;523548;53;3;1;01-02-2007;31-01-2011;02-02-2009;22-12-2009;Ordinária;17-07-2009;03-08-2009;-1;-1;-1;;;;;N/A;;;452372;2009;6099;PL 6099/2009;EDUCAÇÃO,MEIO AMBIENTE E DESENVOLVIMENTO SUSTENTÁVEL;N/A;N/A;-1;SP;SUDESTE;SÃO PAULO;PARTIDO DOS TRABALHADORES;134;PT;N/A;PL;PROJETO DE LEI;PROJETO DE LEI;1;ATIVADO;;N/A;-1;N/A;-1;N/A;TipoParlamentar_10000;DEPUTADO
16-06-2009;;10000;JOSÉ NOBRE GUIMARÃES;JOSÉ GUIMARÃES;M;DEPUTADO;525011;53;3;1;01-02-2007;31-01-2011;02-02-2009;22-12-2009;Ordinária;17-07-2009;03-08-2009;-1;-1;-1;;;;;N/A;;;438658;2009;374;PEC 374/2009;DESENVOLVIMENTO REGIONAL,MEIO AMBIENTE E DESENVOLVIMENTO SUSTENTÁVEL;N/A;N/A;-1;CE;NORDESTE;CEARÁ;PARTIDO DOS TRABALHADORES;134;PT;N/A;PEC;PROPOSTA DE EMENDA À CONSTITUIÇÃO;PROPOSTA DE EMENDA À CONSTITUIÇÃO (ART. 60 CF C/C ART. 201 A 203, RICD);1;ATIVADO;;N/A;-1;N/A;-1;N/A;TipoParlamentar_10000;DEPUTADO
19-05-2009;;10000;JAIRO PAES DE LIRA;PAES DE LIRA;M;DEPUTADO;528530;53;3;1;01-02-2007;31-01-2011;02-02-2009;22-12-2009;Ordinária;17-07-2009;03-08-2009;-1;-1;-1;;;;;N/A;;;434725;2009;5236;PL 5236/2009;MEIO AMBIENTE E DESENVOLVIMENTO SUSTENTÁVEL,SAÚDE;N/A;N/A;-1;SP;SUDESTE;SÃO PAULO;PARTIDO TRABALHISTA CRISTÃO;194;PTC;N/A;PL;PROJETO DE LEI;PROJETO DE LEI;1;ATIVADO;;N/A;-1;N/A;-1;N/A;TipoParlamentar_10000;DEPUTADO
07-02-2011;;10000;ANTONIO CARLOS DE MENDES THAME;ANTONIO CARLOS MENDES THAME;M;DEPUTADO;524132;54;1;1;01-02-2011;31-01-2015;02-02-2011;22-12-2011;Ordinária;18-07-2011;01-08-2011;-1;-1;-1;;;;;N/A;;;491202;2011;176;PL 176/2011;INDÚSTRIA, COMÉRCIO E ABASTECIMENTO,MEIO AMBIENTE E DESENVOLVIMENTO SUSTENTÁVEL;N/A;N/A;-1;SP;SUDESTE;SÃO PAULO;PARTIDO DA SOCIAL DEMOCRACIA BRASILEIRA;128;PSDB;N/A;PL;PROJETO DE LEI;PROJETO DE LEI;1;ATIVADO;;N/A;-1;N/A;-1;N/A;TipoParlamentar_10000;DEPUTADO
30-06-2009;;10000;ANTONIO CARLOS DE MENDES THAME;ANTONIO CARLOS MENDES THAME;M;DEPUTADO;524132;53;3;1;01-02-2007;31-01-2011;02-02-2009;22-12-2009;Ordinária;17-07-2009;03-08-2009;-1;-1;-1;;;;;N/A;;;440396;2009;493;PLP 493/2009;INDÚSTRIA, COMÉRCIO E DEFESA DO CONSUMIDOR (UTILIZADO ATÉ A LEGISLATURA 53),MEIO AMBIENTE E DESENVOLVIMENTO SUSTENTÁVEL;N/A;N/A;-1;SP;SUDESTE;SÃO PAULO;PARTIDO DA SOCIAL DEMOCRACIA BRASILEIRA;128;PSDB;N/A;PLP;PROJETO DE LEI COMPLEMENTAR;PROJETO DE LEI COMPLEMENTAR (ART. 61 CF);1;ATIVADO;;N/A;-1;N/A;-1;N/A;TipoParlamentar_10000;DEPUTADO
19-11-2008;;10000;EDSON GONÇALVES DUARTE;EDSON DUARTE;M;DEPUTADO;520399;53;2;1;01-02-2007;31-01-2011;06-02-2008;22-12-2008;Ordinária;17-07-2008;01-08-2008;-1;-1;-1;;;;;N/A;;;416615;2008;4336;PL 4336/2008;MEIO AMBIENTE E DESENVOLVIMENTO SUSTENTÁVEL,SAÚDE;N/A;N/A;-1;BA;NORDESTE;BAHIA;PARTIDO VERDE;140;PV;N/A;PL;PROJETO DE LEI;PROJETO DE LEI;1;ATIVADO;;N/A;-1;N/A;-1;N/A;TipoParlamentar_10000;DEPUTADO
10-03-2010;;10000;DOMINGOS FRANCISCO DUTRA FILHO;DOMINGOS DUTRA;M;DEPUTADO;525386;53;4;1;01-02-2007;31-01-2011;02-02-2010;22-12-2010;Ordinária;19-07-2010;02-08-2010;-1;-1;-1;;;;;N/A;;;468763;2010;6927;PL 6927/2010;MEIO AMBIENTE E DESENVOLVIMENTO SUSTENTÁVEL;N/A;N/A;-1;MA;NORDESTE;MARANHÃO;PARTIDO DOS TRABALHADORES;134;PT;N/A;PL;PROJETO DE LEI;PROJETO DE LEI;1;ATIVADO;;N/A;-1;N/A;-1;N/A;TipoParlamentar_10000;DEPUTADO
02-09-2009;;10000;ANTÔNIO ROBERTO SOARES;ANTÔNIO ROBERTO;M;DEPUTADO;525549;53;3;1;01-02-2007;31-01-2011;02-02-2009;22-12-2009;Ordinária;17-07-2009;03-08-2009;-1;-1;-1;;;;;N/A;;;448294;2009;5975;PL 5975/2009;EDUCAÇÃO,MEIO AMBIENTE E DESENVOLVIMENTO SUSTENTÁVEL;N/A;N/A;-1;MG;SUDESTE;MINAS GERAIS;PARTIDO VERDE;140;PV;N/A;PL;PROJETO DE LEI;PROJETO DE LEI;1;ATIVADO;;N/A;-1;N/A;-1;N/A;TipoParlamentar_10000;DEPUTADO
13-07-2010;;10000;JOSÉ FERNANDO APARECIDO DE OLIVEIRA;JOSÉ FERNANDO APARECIDO DE OLIVEIRA;M;DEPUTADO;525729;53;4;1;01-02-2007;31-01-2011;02-02-2010;22-12-2010;Ordinária;19-07-2010;02-08-2010;-1;-1;-1;;;;;N/A;;;483485;2010;7630;PL 7630/2010;MEIO AMBIENTE E DESENVOLVIMENTO SUSTENTÁVEL,VIAÇÃO E TRANSPORTES;N/A;N/A;-1;MG;SUDESTE;MINAS GERAIS;PARTIDO VERDE;140;PV;N/A;PL;PROJETO DE LEI;PROJETO DE LEI;1;ATIVADO;;N/A;-1;N/A;-1;N/A;TipoParlamentar_10000;DEPUTADO
31-05-2011;;10000;ONOFRE SANTO AGUSTINI;ONOFRE SANTO AGOSTINI;M;DEPUTADO;530175;54;1;1;01-02-2011;31-01-2015;02-02-2011;22-12-2011;Ordinária;18-07-2011;01-08-2011;-1;-1;-1;;;;;N/A;;;504575;2011;1466;PL 1466/2011;MEIO AMBIENTE E DESENVOLVIMENTO SUSTENTÁVEL;N/A;N/A;-1;SC;SUL;SANTA CATARINA;DEMOCRATAS;202;DEM;N/A;PL;PROJETO DE LEI;PROJETO DE LEI;1;ATIVADO;;N/A;-1;N/A;-1;N/A;TipoParlamentar_10000;DEPUTADO
22-03-2011;;10000;JONAS DONIZETTE FERREIRA;JONAS DONIZETTE;M;DEPUTADO;530200;54;1;1;01-02-2011;31-01-2015;02-02-2011;22-12-2011;Ordinária;18-07-2011;01-08-2011;-1;-1;-1;;;;;N/A;;;495467;2011;775;PL 775/2011;MEIO AMBIENTE E DESENVOLVIMENTO SUSTENTÁVEL;N/A;N/A;-1;SP;SUDESTE;SÃO PAULO;PARTIDO SOCIALISTA BRASILEIRO;125;PSB;N/A;PL;PROJETO DE LEI;PROJETO DE LEI;1;ATIVADO;;N/A;-1;N/A;-1;N/A;TipoParlamentar_10000;DEPUTADO
11-05-2011;;10000;ROGÉRIO MENDONÇA;ROGÉRIO PENINHA MENDONÇA;M;DEPUTADO;530173;54;1;1;01-02-2011;31-01-2015;02-02-2011;22-12-2011;Ordinária;18-07-2011;01-08-2011;-1;-1;-1;;;;;N/A;;;501627;2011;215;PDC 215/2011;MEIO AMBIENTE E DESENVOLVIMENTO SUSTENTÁVEL;N/A;N/A;-1;SC;SUL;SANTA CATARINA;PARTIDO DO MOVIMENTO DEMOCRÁTICO BRASILEIRO;111;PMDB;N/A;PDC;PROJETO DE DECRETO LEGISLATIVO;PROJETO DE DECRETO LEGISLATIVO;1;ATIVADO;;N/A;-1;N/A;-1;N/A;TipoParlamentar_10000;DEPUTADO
31-08-2011;;10000;EDSON SILVA;EDSON SILVA;M;DEPUTADO;530039;54;1;1;01-02-2011;31-01-2015;02-02-2011;22-12-2011;Ordinária;18-07-2011;01-08-2011;-1;-1;-1;;;;;N/A;;;518429;2011;2193;PL 2193/2011;MEIO AMBIENTE E DESENVOLVIMENTO SUSTENTÁVEL;N/A;N/A;-1;CE;NORDESTE;CEARÁ;PARTIDO SOCIALISTA BRASILEIRO;125;PSB;N/A;PL;PROJETO DE LEI;PROJETO DE LEI;1;ATIVADO;;N/A;-1;N/A;-1;N/A;TipoParlamentar_10000;DEPUTADO
05-06-2014;;10000;ARNALDO JORDY FIGUEIREDO;ARNALDO JORDY;M;DEPUTADO;530092;54;4;1;01-02-2011;31-01-2015;03-02-2014;22-12-2014;Ordinária;31-07-2014;01-08-2014;-1;-1;-1;;;;;N/A;;;618561;2014;404;PLP 404/2014;MEIO AMBIENTE E DESENVOLVIMENTO SUSTENTÁVEL;N/A;N/A;-1;PA;NORTE;PARÁ;PARTIDO POPULAR SOCIALISTA;118;PPS;N/A;PLP;PROJETO DE LEI COMPLEMENTAR;PROJETO DE LEI COMPLEMENTAR (ART. 61 CF);1;ATIVADO;;N/A;-1;N/A;-1;N/A;TipoParlamentar_10000;DEPUTADO
16-07-2014;;10000;GERALDO RESENDE PEREIRA;GERALDO RESENDE;M;DEPUTADO;521466;54;4;1;01-02-2011;31-01-2015;03-02-2014;22-12-2014;Ordinária;31-07-2014;01-08-2014;-1;-1;-1;;;;;N/A;;;620487;2014;7818;PL 7818/2014;MEIO AMBIENTE E DESENVOLVIMENTO SUSTENTÁVEL,RECURSOS HÍDRICOS, MINERAIS E POLÍTICA ENERGÉTICA;N/A;N/A;-1;MS;CENTRO-OESTE;MATO GROSSO DO SUL;PARTIDO DO MOVIMENTO DEMOCRÁTICO BRASILEIRO;111;PMDB;N/A;PL;PROJETO DE LEI;PROJETO DE LEI;1;ATIVADO;;N/A;-1;N/A;-1;N/A;TipoParlamentar_10000;DEPUTADO
12-07-2007;;10000;TALMIR RODRIGUES;DR. TALMIR;M;DEPUTADO;529019;53;1;1;01-02-2007;31-01-2011;02-02-2007;24-12-2007;Ordinária;17-07-2007;01-08-2007;-1;-1;-1;;;;;N/A;;;359891;2007;1609;PL 1609/2007;INDÚSTRIA, COMÉRCIO E DEFESA DO CONSUMIDOR (UTILIZADO ATÉ A LEGISLATURA 53),MEIO AMBIENTE E DESENVOLVIMENTO SUSTENTÁVEL;N/A;N/A;-1;SP;SUDESTE;SÃO PAULO;PARTIDO VERDE;140;PV;N/A;PL;PROJETO DE LEI;PROJETO DE LEI;1;ATIVADO;;N/A;-1;N/A;-1;N/A;TipoParlamentar_10000;DEPUTADO
27-05-2008;;10000;JANETE MARIA GÓES CAPIBERIBE;JANETE CAPIBERIBE;F;DEPUTADO;520257;53;2;1;01-02-2007;31-01-2011;06-02-2008;22-12-2008;Ordinária;17-07-2008;01-08-2008;-1;-1;-1;;;;;N/A;;;396442;2008;3455;PL 3455/2008;DESENVOLVIMENTO REGIONAL,MEIO AMBIENTE E DESENVOLVIMENTO SUSTENTÁVEL;N/A;N/A;-1;AP;NORTE;AMAPÁ;PARTIDO SOCIALISTA BRASILEIRO;125;PSB;N/A;PL;PROJETO DE LEI;PROJETO DE LEI;1;ATIVADO;;N/A;-1;N/A;-1;N/A;TipoParlamentar_10000;DEPUTADO
